[
  {
    "province_city": "City of Manila",
    "name": "ABANTE, BIENVENIDO M., JR.",
    "district": "6th District",
    "contact": "[REDACTED]"
  },
  {
    "province_city": "City of Antipolo",
    "name": "ACOP, ROMEO M.",
    "district": "2nd District",
    "contact": "[REDACTED]"
  },
  {
    "province_city": "Palawan",
    "name": "ACOSTA, GIL \"KABARANGAYJR\"",
    "district": "3rd District",
    "contact": "[REDACTED]"
  },
  {
    "province_city": "Lanao Del Sur",
    "name": "ADIONG, ZIAUR-RAHMAN \"ZIA\" ALONTO",
    "district": "1st District",
    "contact": "[REDACTED]"
  },
  {
    "province_city": "Cavite",
    "name": "ADVINCULA, ADRIAN JAY C.",
    "district": "3rd District",
    "contact": "[REDACTED]"
  },
  {
    "province_city": "Laguna",
    "name": "AGARAO, BENJAMIN C., JR.",
    "district": "4th District",
    "contact": "[REDACTED]"
  },
  {
    "province_city": "Kalinga",
    "name": "AGYAO, CAROLINE B., MD.",
    "district": "Lone",
    "contact": "[REDACTED]"
  },
  {
    "province_city": "Basilan",
    "name": "ALANO, USTADZ YUSOP T.",
    "district": "Lone",
    "contact": "[REDACTED]"
  },
  {
    "province_city": "Bukidnon",
    "name": "ALBA, JOSE MANUEL F.",
    "district": "1st District",
    "contact": "[REDACTED]"
  },
  {
    "province_city": "Isabela",
    "name": "ALBANO, ANTONIO \"TONYPET\" T.",
    "district": "1st District",
    "contact": "[REDACTED]"
  },
  {
    "province_city": "Davao Oriental",
    "name": "ALMARIO, CHEENO MIGUEL D.",
    "district": "2nd District",
    "contact": "[REDACTED]"
  },
  {
    "province_city": "City of Makati",
    "name": "ALMARIO, DENNIS \"ALDEN\" B.",
    "district": "2nd District",
    "contact": "[REDACTED]"
  },
  {
    "province_city": "Misamis Occidental",
    "name": "ALMONTE, JASON P.",
    "district": "1st District",
    "contact": "[REDACTED]"
  },
  {
    "province_city": "Palawan",
    "name": "ALVAREZ, JOSE C.",
    "district": "2nd District",
    "contact": "[REDACTED]"
  },
  {
    "province_city": "Negros Occidental",
    "name": "ALVAREZ, MERCEDES K.",
    "district": "6th District",
    "contact": "[REDACTED]"
  },
  {
    "province_city": "Laguna",
    "name": "AMANTE, LORETO S.",
    "district": "3rd District",
    "contact": "[REDACTED]"
  },
  {
    "province_city": "Zamboanga Del Norte",
    "name": "AMATONG, ADRIAN MICHAEL A.",
    "district": "3rd District",
    "contact": "[REDACTED]"
  },
  {
    "province_city": "Aurora",
    "name": "ANGARA, ROMMEL RICO T.",
    "district": "Lone",
    "contact": "[REDACTED]"
  },
  {
    "province_city": "Tarlac",
    "name": "ANGELES, MARIA CRISTINA C.",
    "district": "2nd District",
    "contact": "[REDACTED]"
  },
  {
    "province_city": "City of Butuan",
    "name": "AQUINO, JOSE \"JOBOY\" S. II",
    "district": "Lone",
    "contact": "[REDACTED]"
  },
  {
    "province_city": "Sulu",
    "name": "ARBISON, MUNIR M.",
    "district": "2nd District",
    "contact": "[REDACTED]"
  },
  {
    "province_city": "Pangasinan",
    "name": "ARENAS, MARIA RACHEL J.",
    "district": "3rd District",
    "contact": "[REDACTED]"
  },
  {
    "province_city": "Quezon",
    "name": "ARROGANCIA, REYNANTE U.",
    "district": "3rd District",
    "contact": "[REDACTED]"
  },
  {
    "province_city": "City of Caloocan",
    "name": "ASISTIO, DEAN",
    "district": "3rd District",
    "contact": "[REDACTED]"
  },
  {
    "province_city": "Quezon City",
    "name": "ATAYDE, JUAN CARLOS \"ARJO\" C.",
    "district": "1st District",
    "contact": "[REDACTED]"
  },
  {
    "province_city": "Bohol",
    "name": "AUMENTADO, MARIA VANESSA \"VANVAN\" C., RN",
    "district": "2nd District",
    "contact": "[REDACTED]"
  },
  {
    "province_city": "Dinagat Islands",
    "name": "BAG-AO, KAKA J.",
    "district": "Lone",
    "contact": "[REDACTED]"
  },
  {
    "province_city": "Lanao Del Sur",
    "name": "BALINDONG, YASSER ALONTO",
    "district": "2nd District",
    "contact": "[REDACTED]"
  },
  {
    "province_city": "City of General Santos",
    "name": "BAÑAS-NOGRALES, SHIRLYN L.",
    "district": "Lone",
    "contact": "[REDACTED]"
  },
  {
    "province_city": "Zamboanga Sibugay",
    "name": "BANCORO, MARLO C.",
    "district": "1st District",
    "contact": "[REDACTED]"
  },
  {
    "province_city": "Ilocos Norte",
    "name": "BARBA, ANGELO MARCOS",
    "district": "2nd District",
    "contact": "[REDACTED]"
  },
  {
    "province_city": "Surigao Del Norte",
    "name": "BARBERS, BERNADETTE S.",
    "district": "2nd District",
    "contact": "[REDACTED]"
  },
  {
    "province_city": "City of Iloilo",
    "name": "BARONDA, JULIENNE \"JAM\" L.",
    "district": "Lone",
    "contact": "[REDACTED]"
  },
  {
    "province_city": "Cavite",
    "name": "BARZAGA, FRANCISCO \"KIKO\" A.",
    "district": "4th District",
    "contact": "[REDACTED]"
  },
  {
    "province_city": "Agusan Del Sur",
    "name": "BASCUG, ALFELITO \"ALFEL\" M.",
    "district": "1st District",
    "contact": "[REDACTED]"
  },
  {
    "province_city": "Davao Occidental",
    "name": "BAUTISTA, CLAUDE P",
    "district": "Lone",
    "contact": "[REDACTED]"
  },
  {
    "province_city": "City of Bacolod",
    "name": "BENITEZ, ALFREDO \"ALBEE\" B.",
    "district": "Lone",
    "contact": "[REDACTED]"
  },
  {
    "province_city": "Negros Occidental",
    "name": "BENITEZ, JAVIER MIGUEL LOPEZ",
    "district": "3rd District",
    "contact": "[REDACTED]"
  },
  {
    "province_city": "Abra",
    "name": "BERNOS, JB",
    "district": "Lone",
    "contact": "[REDACTED]"
  },
  {
    "province_city": "Iloilo",
    "name": "BIRON, FERJENEL G., MD",
    "district": "4th District",
    "contact": "[REDACTED]"
  },
  {
    "province_city": "City of Taguig",
    "name": "BOCOBO, JORGE DANIEL S.",
    "district": "Lone District (2nd Councilor District)",
    "contact": "[REDACTED]"
  },
  {
    "province_city": "Batangas",
    "name": "BOLILIA, AMADO CARLOS A. IV",
    "district": "4th District",
    "contact": "[REDACTED]"
  },
  {
    "province_city": "Pampanga",
    "name": "BONDOC, ANNA YORK P., MD",
    "district": "4th District",
    "contact": "[REDACTED]"
  },
  {
    "province_city": "Apayao",
    "name": "BULUT-BEGTANG, ELEANOR C.",
    "district": "Lone",
    "contact": "[REDACTED]"
  },
  {
    "province_city": "Davao Del Sur",
    "name": "CAGAS, JOHN TRACY F.",
    "district": "Lone",
    "contact": "[REDACTED]"
  },
  {
    "province_city": "Cebu",
    "name": "CALDERON, PATRICIA C.",
    "district": "7th District",
    "contact": "[REDACTED]"
  },
  {
    "province_city": "Pasay City",
    "name": "CALIXTO, ANTONINO G.",
    "district": "Lone",
    "contact": "[REDACTED]"
  },
  {
    "province_city": "Cotabato",
    "name": "CAOAGDAN, RUDY S., DPA",
    "district": "2nd District",
    "contact": "[REDACTED]"
  },
  {
    "province_city": "Leyte",
    "name": "CARI, CARL NICOLAS C.",
    "district": "5th District",
    "contact": "[REDACTED]"
  },
  {
    "province_city": "Capiz",
    "name": "CASTRO, JANE T.",
    "district": "2nd District",
    "contact": "[REDACTED]"
  },
  {
    "province_city": "Nueva Vizcaya",
    "name": "CAYTON, TIMOTHY JOSEPH E.",
    "district": "Lone",
    "contact": "[REDACTED]"
  },
  {
    "province_city": "Pangasinan",
    "name": "CELESTE, ARTHUR F.",
    "district": "1st District",
    "contact": "[REDACTED]"
  },
  {
    "province_city": "Davao De Oro",
    "name": "CENIZA, LEONEL \"JHONG\" D.",
    "district": "2nd District",
    "contact": "[REDACTED]"
  },
  {
    "province_city": "City of Lapu-Lapu",
    "name": "CHAN, JUNARD \"AHONG\" Q.",
    "district": "Lone",
    "contact": "[REDACTED]"
  },
  {
    "province_city": "City of Manila",
    "name": "CHUA, JOEL R.",
    "district": "3rd District",
    "contact": "[REDACTED]"
  },
  {
    "province_city": "City of Zamboanga",
    "name": "CHUA-TAI, KATRINA REIKO",
    "district": "1st District",
    "contact": "[REDACTED]"
  },
  {
    "province_city": "Ifugao",
    "name": "CHUNGALAO, SOLOMON R.",
    "district": "Lone",
    "contact": "[REDACTED]"
  },
  {
    "province_city": "Tarlac",
    "name": "COJUANGCO, JAIME EDUARDO MARC D.",
    "district": "1st District",
    "contact": "[REDACTED]"
  },
  {
    "province_city": "Pangasinan",
    "name": "COJUANGCO, MARK O.",
    "district": "2nd District",
    "contact": "[REDACTED]"
  },
  {
    "province_city": "Batangas",
    "name": "COLLANTES, KING GEORGE LEANDRO ANTONIO V.",
    "district": "3rd District",
    "contact": "[REDACTED]"
  },
  {
    "province_city": "Quezon City",
    "name": "CO-PILAR, MA. VICTORIA",
    "district": "6th District",
    "contact": "[REDACTED]"
  },
  {
    "province_city": "Agusan Del Norte",
    "name": "CORVERA, DALE B.",
    "district": "Lone",
    "contact": "[REDACTED]"
  },
  {
    "province_city": "Bulacan",
    "name": "CRUZ, AGATHA PAULA AGUILAR",
    "district": "5th District",
    "contact": "[REDACTED]"
  },
  {
    "province_city": "City of Taguig - Pateros",
    "name": "CRUZ, RICARDO S., JR.",
    "district": "Lone",
    "contact": "[REDACTED]"
  },
  {
    "province_city": "Cotabato",
    "name": "CRUZADO, EDWIN L. M.D.",
    "district": "1st District",
    "contact": "[REDACTED]"
  },
  {
    "province_city": "Quirino",
    "name": "CUA, MIDY N.",
    "district": "Lone",
    "contact": "[REDACTED]"
  },
  {
    "province_city": "Mountain Province",
    "name": "DALOG, MAXIMO Y., JR.",
    "district": "Lone",
    "contact": "[REDACTED]"
  },
  {
    "province_city": "Davao Oriental",
    "name": "DAYANGHIRANG, NELSON \"JR\"",
    "district": "1st District",
    "contact": "[REDACTED]"
  },
  {
    "province_city": "Northern Samar",
    "name": "DAZA, NIKO RAUL S.J.",
    "district": "1st District",
    "contact": "[REDACTED]"
  },
  {
    "province_city": "Pangasinan",
    "name": "DE VENECIA, MA. GEORGINA P.",
    "district": "4th District",
    "contact": "[REDACTED]"
  },
  {
    "province_city": "Iloilo",